{
  "$schema": "https://json-schema.org/draft/2020-12/schema",
  "$id": "https://buaflow.dev/schemas/assumption-ledger-v1.json",
  "title": "Buaflow assumption ledger v1",
  "description": "Every guess a project is building on, with who owns it, what breaks if it is wrong, until when it may stand unverified, and how it will be checked (IC-004). The kit already forbids guessing where a person can be asked ([NEEDS CLARIFICATION]); this is for the guesses that have to be made anyway to keep moving, so that each one either gets checked or visibly expires.",
  "type": "object",
  "required": ["schemaVersion", "project", "generatedAt", "assumptions"],
  "properties": {
    "$schema": { "type": "string" },
    "schemaVersion": { "const": "1.0" },
    "_": { "type": "string" },
    "project": { "type": "string", "minLength": 1 },
    "generatedAt": { "type": "string", "format": "date-time" },
    "assumptions": {
      "type": "array",
      "minItems": 1,
      "items": { "$ref": "#/$defs/assumption" }
    }
  },
  "additionalProperties": false,
  "$defs": {
    "assumption": {
      "type": "object",
      "required": ["id", "statement", "madeIn", "owner", "impact", "madeOn", "expiresOn", "verification"],
      "properties": {
        "id": { "type": "string", "pattern": "^A-[0-9]{3,}$" },
        "statement": { "type": "string", "minLength": 10, "description": "The guess, stated so that it can turn out false." },
        "madeIn": { "type": "string", "minLength": 1, "description": "Repository-relative file where the guess is relied on (intent, spec, ADR). Checked for existence." },
        "owner": { "type": "string", "minLength": 1, "description": "A person who can confirm or refute it — not a team, not 'AI'." },
        "impact": { "enum": ["low", "medium", "high"], "description": "What breaks if it is wrong: high = architecture, security, money or data; medium = a feature's shape; low = wording or defaults." },
        "madeOn": { "type": "string", "format": "date" },
        "expiresOn": { "type": "string", "format": "date", "description": "The last day this guess may stand unverified. After it, an open assumption fails the gate." },
        "verification": { "$ref": "#/$defs/verification" }
      },
      "additionalProperties": false
    },
    "verification": {
      "type": "object",
      "required": ["method", "status"],
      "properties": {
        "method": { "type": "string", "minLength": 10, "description": "How it will be checked: who is asked, what is measured, which test would fail." },
        "status": { "enum": ["open", "confirmed", "refuted"] },
        "resolvedOn": { "type": "string", "format": "date" },
        "evidence": { "type": "array", "minItems": 1, "items": { "$ref": "#/$defs/evidence" } },
        "consequence": { "type": "string", "minLength": 10, "description": "Required when refuted: what was changed because the guess was wrong." }
      },
      "additionalProperties": false
    },
    "evidence": {
      "type": "object",
      "required": ["type", "value"],
      "properties": {
        "type": { "enum": ["command", "file", "url", "manual"] },
        "value": { "type": "string", "minLength": 1 }
      },
      "additionalProperties": false
    }
  }
}
